{
  "schema": "claude-legal-audit.edge-type-library.v1",
  "revision": "1.0.0",
  "status": "candidate_governed",
  "pairs": [
    {"pair_id":"EDP-0001","family":"structure","forward":"CONTAINS","inverse":"CONTAINED_BY","source_types":["repository","revision","file","argument_object"],"target_types":["revision","file","chunk","argument_object"],"meaning":"The target is structurally nested within the source for this governed projection.","non_implication":"Containment does not establish ownership, causation, endorsement, or evidentiary support.","cycle_policy":"forbidden_forward","promotion_policy":"candidate_until_evidence_and_review_gates_pass"},
    {"pair_id":"EDP-0002","family":"structure","forward":"NEXT_IN_PARENT","inverse":"PREVIOUS_IN_PARENT","source_types":["chunk"],"target_types":["chunk"],"meaning":"The target byte span immediately follows the source span in one immutable parent.","non_implication":"Adjacency does not establish semantic similarity, causal sequence, or argumentative relation.","cycle_policy":"not_applicable","promotion_policy":"candidate_until_evidence_and_review_gates_pass"},
    {"pair_id":"EDP-0003","family":"structure","forward":"AT_REVISION","inverse":"HAS_AT_REVISION","source_types":["source","pr","file"],"target_types":["revision","commit"],"meaning":"The source record is explicitly bound to the identified repository revision or commit.","non_implication":"Revision binding does not establish runtime deployment, completeness, or present behavior.","cycle_policy":"not_applicable","promotion_policy":"candidate_until_evidence_and_review_gates_pass"},
    {"pair_id":"EDP-0004","family":"structure","forward":"MODIFIES_PATH","inverse":"MODIFIED_BY","source_types":["pr","commit"],"target_types":["file"],"meaning":"A verified Git comparison records the source change object as modifying the target path.","non_implication":"A modified path does not establish strategy, intent, feature use, or runtime effect.","cycle_policy":"not_applicable","promotion_policy":"candidate_until_evidence_and_review_gates_pass"},
    {"pair_id":"EDP-0005","family":"provenance","forward":"CAPTURED_FROM","inverse":"HAS_CAPTURE","source_types":["capture"],"target_types":["source","pr","commit"],"meaning":"The capture is a bounded observation retrieved from the target public source or record.","non_implication":"Capture does not establish remote completeness, later state, private data, or authenticity beyond custody checks.","cycle_policy":"not_applicable","promotion_policy":"candidate_until_evidence_and_review_gates_pass"},
    {"pair_id":"EDP-0006","family":"provenance","forward":"DERIVED_FROM","inverse":"HAS_DERIVATIVE","source_types":["claim","argument_object","paper_section","proof_gap"],"target_types":["source","chunk","claim","argument_object"],"meaning":"The source artifact was created by a declared transformation of the target evidence object.","non_implication":"Derivation does not make an inference correct or transfer the target's authority to the derivative.","cycle_policy":"forbidden_forward","promotion_policy":"candidate_until_evidence_and_review_gates_pass"},
    {"pair_id":"EDP-0007","family":"provenance","forward":"HASH_BINDS","inverse":"HASH_BOUND_BY","source_types":["capture","chunk","revision"],"target_types":["source","file","repository"],"meaning":"A recorded cryptographic digest binds the source observation to the target representation.","non_implication":"A matching hash establishes byte identity only, not truth, legality, meaning, or completeness.","cycle_policy":"not_applicable","promotion_policy":"candidate_until_evidence_and_review_gates_pass"},
    {"pair_id":"EDP-0008","family":"provenance","forward":"LOCATES","inverse":"LOCATED_BY","source_types":["source","chunk","claim"],"target_types":["file","chunk","source"],"meaning":"The source supplies a reproducible locator into the target evidence object or parent.","non_implication":"A locator does not by itself show that the located bytes support the proposed claim.","cycle_policy":"not_applicable","promotion_policy":"candidate_until_evidence_and_review_gates_pass"},
    {"pair_id":"EDP-0009","family":"evidence","forward":"EVIDENCES","inverse":"EVIDENCED_BY","source_types":["source","chunk","claim"],"target_types":["claim","argument_object","proof_gap"],"meaning":"The reviewed source is cited as support for the bounded target proposition or status.","non_implication":"Evidence does not imply exclusivity, sufficiency, causation, or conclusions beyond the target boundary.","cycle_policy":"not_applicable","promotion_policy":"candidate_until_evidence_and_review_gates_pass"},
    {"pair_id":"EDP-0010","family":"evidence","forward":"CONSTRAINS","inverse":"CONSTRAINED_BY","source_types":["source","claim","proof_gap"],"target_types":["claim","argument_object","paper_section"],"meaning":"The source narrows the permissible interpretation or publication boundary of the target.","non_implication":"A constraint is not necessarily contrary evidence and does not falsify the whole target.","cycle_policy":"not_applicable","promotion_policy":"candidate_until_evidence_and_review_gates_pass"},
    {"pair_id":"EDP-0011","family":"evidence","forward":"CONTRADICTS","inverse":"CONTRADICTED_BY","source_types":["source","claim"],"target_types":["claim","argument_object"],"meaning":"The reviewed source supplies materially incompatible evidence within a declared scope.","non_implication":"Contradiction in one scope does not establish fraud, intent, or universal falsity.","cycle_policy":"allowed","promotion_policy":"candidate_until_evidence_and_review_gates_pass"},
    {"pair_id":"EDP-0012","family":"evidence","forward":"LEAVES_UNKNOWN","inverse":"UNKNOWN_LEFT_BY","source_types":["source","claim","capture"],"target_types":["claim","proof_gap"],"meaning":"The bounded evidence explicitly fails to resolve the target question or proposition.","non_implication":"Unknown does not mean false, true, harmless, impossible, or absent from all evidence.","cycle_policy":"not_applicable","promotion_policy":"candidate_until_evidence_and_review_gates_pass"},
    {"pair_id":"EDP-0013","family":"argument","forward":"SUPPORTS","inverse":"SUPPORTED_BY","source_types":["claim","argument_object"],"target_types":["argument_object"],"meaning":"The source contributes a declared reason in favor of the bounded target argument.","non_implication":"Support is neither proof nor a claim that all objections have been answered.","cycle_policy":"allowed","promotion_policy":"candidate_until_evidence_and_review_gates_pass"},
    {"pair_id":"EDP-0014","family":"argument","forward":"CHALLENGES","inverse":"CHALLENGED_BY","source_types":["claim","argument_object"],"target_types":["argument_object"],"meaning":"The source states an objection or counterconsideration against the bounded target argument.","non_implication":"A challenge need not falsify the target and does not receive automatic priority.","cycle_policy":"allowed","promotion_policy":"candidate_until_evidence_and_review_gates_pass"},
    {"pair_id":"EDP-0015","family":"argument","forward":"REBUTS","inverse":"REBUTTED_BY","source_types":["argument_object"],"target_types":["argument_object"],"meaning":"The source directly answers a declared objection without erasing its residual force.","non_implication":"A rebuttal does not prove the thesis or retire the objection without review.","cycle_policy":"allowed","promotion_policy":"candidate_until_evidence_and_review_gates_pass"},
    {"pair_id":"EDP-0016","family":"argument","forward":"FALSIFIES_IF","inverse":"FALSIFIER_OF","source_types":["argument_object"],"target_types":["proof_gap","argument_object"],"meaning":"The target condition is declared capable of falsifying or materially weakening the source proposition.","non_implication":"An untested falsifier is not evidence that its condition currently holds.","cycle_policy":"not_applicable","promotion_policy":"candidate_until_evidence_and_review_gates_pass"},
    {"pair_id":"EDP-0017","family":"argument","forward":"HAS_PROOF_GAP","inverse":"PROOF_GAP_OF","source_types":["claim","argument_object"],"target_types":["proof_gap"],"meaning":"The target identifies missing evidence required for a stronger version of the source proposition.","non_implication":"A proof gap does not make every bounded or normative form of the source unusable.","cycle_policy":"not_applicable","promotion_policy":"candidate_until_evidence_and_review_gates_pass"},
    {"pair_id":"EDP-0018","family":"argument","forward":"PRESENTED_IN","inverse":"PRESENTS","source_types":["claim","argument_object","proof_gap"],"target_types":["paper_section"],"meaning":"The source proposition is projected into the target human-readable paper section.","non_implication":"Presentation does not change review status, authority, or publication eligibility.","cycle_policy":"not_applicable","promotion_policy":"candidate_until_evidence_and_review_gates_pass"},
    {"pair_id":"EDP-0019","family":"lifecycle","forward":"SUPERSEDES","inverse":"SUPERSEDED_BY","source_types":["claim","argument_object","paper_section"],"target_types":["claim","argument_object","paper_section"],"meaning":"The source is the declared current replacement for the target within the same identity lineage.","non_implication":"Supersession does not delete history or prove the replacement substantively correct.","cycle_policy":"forbidden_forward","promotion_policy":"candidate_until_evidence_and_review_gates_pass"},
    {"pair_id":"EDP-0020","family":"lifecycle","forward":"RETIRES","inverse":"RETIRED_BY","source_types":["claim","argument_object"],"target_types":["claim","argument_object"],"meaning":"The source lifecycle decision removes the target from active evidentiary or argumentative use.","non_implication":"Retirement does not erase provenance or establish that the target was always false.","cycle_policy":"not_applicable","promotion_policy":"candidate_until_evidence_and_review_gates_pass"},